{
  "contractVersion": "1.0",
  "deliveryId": "018f47a2-7b3c-7def-8123-456789abcdef",
  "eventType": "position",
  "protocol": "meshtastic",
  "receiver": {
    "receiverAgentId": "11111111-1111-4111-8111-111111111111",
    "installationId": "0123456789abcdef0123456789abcdef",
    "adapter": "meshtastic-native",
    "adapterVersion": "1.0.0",
    "observedAt": "2026-08-19T12:34:56.789Z"
  },
  "subject": {
    "protocolNamespace": "meshtastic_node_id",
    "canonicalId": "!1234abcd",
    "displayId": "field-node",
    "verification": "unverified"
  },
  "occurredAt": {
    "value": "2026-08-19T12:34:55.000Z",
    "origin": "protocol"
  },
  "radio": {
    "metrics": [
      { "kind": "rssi", "value": -104, "unit": "dBm", "origin": "receiver_local" },
      { "kind": "snr", "value": 6.25, "unit": "dB", "origin": "receiver_local" }
    ],
    "routeKind": "unknown"
  },
  "position": {
    "lat": 52.52,
    "lon": 13.405,
    "altM": 34.5,
    "verification": "unverified"
  },
  "capabilities": {
    "position_signed": "unavailable",
    "receiver_rssi": "available",
    "receiver_snr": "available"
  },
  "source": {
    "protocolVersion": "2.6.0",
    "nativeMessageType": "POSITION_APP",
    "nativeMessageId": "987654321",
    "rawEncoding": "base64",
    "raw": "AQIDBA==",
    "rawSha256": "9f64a747e1b97f131fabb6b447296c9b6f0201e79fb3c5356e6c77e89b6a806a"
  },
  "contentKey": "meshtastic:2.6.0:POSITION_APP:!1234abcd:987654321"
}
